{
  "apiVersion": "edgeai.stream/v1",
  "generation": 1,
  "kind": "DATA",
  "mediaType": "application/json",
  "payloadBase64": "eyJ2YWx1ZSI6MjMuNX0=",
  "producer": {
    "deviceId": "33333333-3333-4333-8333-333333333333",
    "epoch": 1,
    "kind": "DEVICE_SESSION",
    "sessionId": "22222222-2222-4222-8222-222222222222"
  },
  "routeId": "11111111-1111-4111-8111-111111111111",
  "sequence": 1,
  "sha256": "4c3a6f174c4c28c21b57502867983a281f72e0dac75b806294c6b1b8aaeb4ebe"
}
